ABBV, ABBVIE INC,New York Stock Exchange,Healthcare Health Care,Services,Large Blend
AET, AETNA INC NEW,New York Stock Exchange,Healthcare Health Care,Services,Small Growth
AZN, ASTRAZENECA,London Main Market  U.K.,Healthcare Large,Value,AUROPHARMA
MCK, MCKESSON CORP,New York Stock Exchange,Healthcare Health Care,Services,Large Value
MDC, MEDICLINIC INTERNA,London Main Market  U.K.,Healthcare Health Care,Services,Mid Value
UNH, UNITEDHEALTH GROUP INC,New York Stock Exchange,Healthcare Health Care,Services,Large Growth
